Grant ID,Grant Name,Eligibility Notes / Comments,Soft Approval Status
001,Women Innovators Fund,Meets preliminary criteria; partner review needed,Yes
003,Innovation Scale-up Grant,Requires documentation check,Yes
005,Fintech Innovation Challenge,Pre-approved for eligible fintech startups,Yes
008,Women Entrepreneurs Scheme,Fast-track approval for first-time women founders,Yes
009,Green Technology Fund,Preliminary approval for clean energy projects,Yes
011,Healthcare Innovation Fund,Pre-screening completed; documentation pending,Yes